id,timestamp,author,likeCount,text
Ugw7DX9EYpktDLDQcut4AaABAg,1646092800,Mtsuha Myamizu,0,imiss you pls balik ka na
UgxPKe3KGNsPFrw3o1Z4AaABAg,1643673600,이서진,0,울지마ㅠㅠㅠㅠㅠㅠㅠㅠㅠㅠㅠㅠㅠㅠㅠㅠㅠ
Ugx5wBmLUBVrM4UzWat4AaABAg,1625097600,デージマ　ディエゴ,0,オペラオーよりも笑い声でかっ！鼓膜が吹っ飛んだ
Ugxp4d4FGMrseQbpJtd4AaABAg,1619827200,はるはる,1,"I'm sure I will be here.　My 推し might be only more and more, but the love to any of you never change
Thank you
We love you"
UgwTtBZCCTMlwTVVNil4AaABAg,1617235200,Young,0,23:53 28:51 28:59
UgwOXREfOhg2KJWVWzF4AaABAg,1617235200,ジャンヌ・ダルク,2,1:09:18 可愛い❤️
Ugxbqg_8A41gUc2C8Ip4AaABAg,1617235200,Monster Tokusatsu,1,"Halo Dada Rata, Gimana Kabar Papan. Sudah kah Tumbuh. Jangan Artikan Komentar Ini Atau Akan Terjadi Tragedi"
UgyXc9TL9PaHfl6VOTF4AaABAg,1617235200,うた,0,頷くの可愛すぎる
UgwiqG1Wfv26K0ftO5l4AaABAg,1617235200,yupebet gaming,1,1:25:29 HAHAHAHAHA~
UgwDGoe9zVJmP55LgY94AaABAg,1617235200,あ,0,1:27:34
UgyfbipO27W3wp1ScUN4AaABAg,1617235200,tatta t,2,"25:35
お手本のような上げて落とすで笑ったｗ"
UgxOz2odfIc-AjfGtht4AaABAg,1617235200,Ron man,0,1:27:55   おかのした
Ugw4lznly4ZiebJnK-N4AaABAg,1617235200,じゅじゅき,0,初めて見るけど　うるせぇなぁ
Ugywg5l9QYEG0me7vI54AaABAg,1617235200,かなで猫,0,サイゲまだガチャ優しいのにね……
Ugx_6y29rWpVLDLSMOt4AaABAg,1617235200,ただの17歳,8,オグリキャップとメジロマックイーンおったら最強や
Ugy65nL8W7WEQAdKXq14AaABAg,1617235200,ブラックハート,0,普段ガチャ課金などしないるしあちゃんのウマ娘の本気を見た気がするw　ウマ娘は私の好きなコンテンツなのでいつまでも楽しんでください　覇王もいいけど自分でるしあちゃんを選んだライスちゃんも大事にねｗ
UgxREUek7UlNHlV52TB4AaABAg,1617235200,jason蕭,1,嗯......以跑百米的速度衝去超商買點數，回來繼續直播都沒在喘的（可見露醬平常都有再練的👍
UgyCLETDA9MH1rmAY1l4AaABAg,1617235200,れれ,0,これ見ながら回したら出たわｗ
UgylE1R_5H36ZhpcsAR4AaABAg,1617235200,煉夜,0,ここ最近仕事が忙しくて見れてない...
Ugxpjq3OFAh2RvUDH854AaABAg,1617235200,なーちゃま,1,あぁ、リアタイしたいよぉ！！
Ugwm-NJQfAojpqMj2PV4AaABAg,1617235200,たぬぽん,0,無事致命傷ですんでよかった！
UgxBqPV9_U9Z4hpH-H14AaABAg,1617235200,バチボコよっぴ*,2,るしあ様ありがとうございます✨アーカイブ見ながら単発で引いたらオペラオー引きました✨無課金です🎵🎵🎵
UgwC0qicmRo-Wc_ekP14AaABAg,1617235200,Steve J,0,Yes!! Rushia reads Opera Oh's story @ 1:02:03
Ugxe_3IvTHr9HJAr2zN4AaABAg,1617235200,RX,0,1:16:45
UgwzmcfYSfqz8o8Ppzp4AaABAg,1617235200,elvis Hector Tapuy,1,BEST WAIFUUUUUUUUUUUUUUUUUUUUUUUUUUUUUUUUUUUUUUUUUUUUUUUUUUUUUUUUUUUUUUUUU <3
UgyemZZ8GZCJc6x2XSh4AaABAg,1617235200,Kanae Sumi,0,"毎度神回だが本当に面白かったw
3期生Liveの話だけどしっかり寝て、たっぷり陽の光を浴びてください。お願いします、何でもしますから。"
UgwUotXPXTyv0mfcmXp4AaABAg,1617235200,ゲン,6,"2:43:55    くっそ寒くてすまんかった！　
まさか読んでもらえるとは思わんかった…"
UgwUotXPXTyv0mfcmXp4AaABAg.9KZvdTesI929K_6vDtjRF2,1617235200,Kanae Sumi,1,道連れにしてもらえて良かったなw
UgzC1opVr2DG-l80iSp4AaABAg,1617235200,brothers C.,2,"星3が出なかっただけでグロってどゆこと？
結構確率通りに来てると思うけど"
UgxW0N4a6gF9aygSelx4AaABAg,1617235200,セキ,1,"るしあの配信は面白すぎるｗ
笑い方も大好き！！"
Ugy9WEBnMM_QAYdpIWB4AaABAg,1617235200,Kira Asuka,11,"一回の配信で二回コンビニRTAは草
でも、もしるしあちゃんがガチャゲームで出る時、僕もそうやるかもしれない...
一回目 33:49 37:30 
二回目 48:33 52:53"
UgxJSDoXW7HPAm50MxZ4AaABAg,1617235200,周宅男周宅男,0,笑死   直播中跑去買點卡
Ugz2FbCfVYXeOC5JBvJ4AaABAg,1617235200,DupinAndre,1,"No puede ser, Rushia se volvió aficta a los gachas."
UgxGcc2XxX8xTqkMSp14AaABAg,1617235200,ぺんぎん99,0,こんるしこんるし〜
UgxSf98cuB1dEX4mrL94AaABAg,1617235200,アキロゼと誕生日が同じ人間,1,初天井、欲しいキャラおめでとうございます！！コンビニ2回は笑いましたw自分語りにはなりますが自分もこの前初天井を経験しました天井したあとはスッキリしたような最悪な気分なのか分からなくなりますよねw
UgxJr3F5in2FDXv8JDl4AaABAg,1617235200,Kounomimi,0,What’s the game name?
UgxJr3F5in2FDXv8JDl4AaABAg.9KZ2cu7WQa19KZwUngcOZ_,1617235200,Super Chato Alien,0,It's called Umamusume. There's also anime series.
UgyIwlpPYInmQRc3RT54AaABAg,1617235200,りょう,1,"お目当ての娘が当たってよかったですね。おめでとうございます！
一緒にウマ娘の話したいので今日からはじめます。"
Ugww_SaVZbE6FRemAeZ4AaABAg,1617235200,たたたいも,1,るしあ可愛いすぎー！
UgwXVTiwkRuw_TQRSEV4AaABAg,1617235200,さいころ,0,"テイエムオペラオーって強いんですか？
ウマ娘始めたばっかなので教えて欲しいです。"
UgwXVTiwkRuw_TQRSEV4AaABAg.9KYyXytdRng9KZ43u4N2kX,1617235200,ちゅん吉まる,0,ステータスをバランス良く振らないといけないので育成がやや難しいですが、スキルがかなり優秀なので育てきれればかなり強力なウマ娘です。
UgwXVTiwkRuw_TQRSEV4AaABAg.9KYyXytdRng9KZPR2WoBgc,1617235200,チェロちゃん,0,"このうま娘は、どの馬も☆を上げれば強いですよ。
 ☆３だから強くなっているという概念はこのゲームにはないですよ"
UgwXVTiwkRuw_TQRSEV4AaABAg.9KYyXytdRng9KZqBofw2wV,1617235200,さいころ,0, @ちゅん吉まる  教えていただきありがとうございます！！
UgwXVTiwkRuw_TQRSEV4AaABAg.9KYyXytdRng9KZqEqyqh1j,1617235200,さいころ,0, @チェロちゃん  なるほど………教えていただきありがとうございます！
UgzwxLdxPFT8p8864zJ4AaABAg,1617235200,Lastlasagna,9,Rushia trying to integrate herself into the game with the princely character is the cutest thing ever.
UgxJiZ5p9HZtKrCjllx4AaABAg,1617235200,オワキ1123,0,ガチャあちぃー
UgxbbRjdjlbkpjfIdY94AaABAg,1617235200,Hogan Donahue,0,Poor Rushia getting bad pulls X3
Ugz5CEJ2VE-_DtS6jKJ4AaABAg,1617235200,Ela._.,42,1:26:13 HAHAHAHAHAHAHA
UgyEK5kr3pAQuoUeRjR4AaABAg,1617235200,zoro,0,Hola
UgxQvmuCK4bKlFi0vUR4AaABAg,1617235200,ピノピノ,2,るしあがさけんだ時地味に音量下げてるの俺以外絶対いるはず…💧
Ugz0ZJFxbjJhai5QEeR4AaABAg,1617235200,ほっとケーキ,0,ヌマ娘
Ugx8zZ6S4zpBwXLYvOx4AaABAg,1617235200,* omiso,12,ガチャを引く前に見ると冷静になれる教育的配信
UgyFxiwiMppCJAnM-cJ4AaABAg,1617235200,Vyse,6,"She looks so happy playing this game. 
Thank you Rushia for the fun!"
UgxH1Wn0TzgdBkD0eDZ4AaABAg,1617235200,alice,0,好きな子のストーリー見てるるしあちゃん面白くて可愛すぎる
UgysSkaVjXiCpVnW3oh4AaABAg,1617235200,yusha poi,0,lastly this game release
UgxJ5nNeAO8xSii6oVN4AaABAg,1617235200,シオンすきすきbot,4,2:59:41
UgycwC_Qatu9fYvKb5l4AaABAg,1617235200,Yagoo but not really,3,Thanks for the stream rushia
UgwVBDCcGq-UJW9hSzl4AaABAg,1617235200,Sharky Gawrrr,55,"Blessings from Rushia
1:09:35 Aaaaaaa + surprised happy Rushia 
1:29:39 
1:30:22 
1:33:39
1:35:31 
1:35:56 Menacing laugh
1:38:05 
1:38:13 Warning: Bless your ears* 
1:43:32"
UgwVBDCcGq-UJW9hSzl4AaABAg.9KYUsRKJeG29Kc8u-_W6aY,1617235200,Raruku Maaru,1,Thanks for the timestamps
UgyN7WxAy6tsEKPoi1F4AaABAg,1617235200,Redan Kenneth Uy,13,"Blessing 17:40 42:16 43:49 1:09:35 1:29:39 1:30:22 1:35:31 1:35:55 1:38:05 1:38:13 1:43:32
Pain 19:23 29:10 58:56 59:51 1:13:35 1:14:32
Panik 1:14:07 1:16:37 1:33:38
1:19:11 Flirting for almost 10 mins"
UgyN7WxAy6tsEKPoi1F4AaABAg.9KYU8Vs9djF9KYV0or8nKb,1617235200,Redan Kenneth Uy,0,The illegal panik timestamp number is 1 hr 10 mins and 13 seconds. I already tried setting it 2 seconds earlier but it is still got hidden.
UgyN7WxAy6tsEKPoi1F4AaABAg.9KYU8Vs9djF9KYlhiYzNYs,1617235200,Sharky Gawrrr,0,May I ask why that number couldn't work?
UgwUC6ZxDZg4FEvQXkZ4AaABAg,1617235200,ぽんぽこ・たんじぇんと,6,何がとは言いませんが、１周目3:39、２周目4:20大体それくらいでした。いつも一生懸命でかわいい。（ルシア最速）
UgxlV_G-eyEulW5Hci14AaABAg,1617235200,白井御飯,5,ライスシャワーのストーリー知ってガン泣きすれば良いとおもいましたまる
UgxlV_G-eyEulW5Hci14AaABAg.9KYTxqXw3qW9KYtRyJdqac,1617235200,たこ焼き,0,上げる人ならいるよ
UgxzfP2X7BcJKRfaW054AaABAg,1617235200,うすみどり,2,"ウマ娘ガチャ配信おつるし〜
ガチャって怖いよね…
これだけあれば確実っ！って思っても、それを優に超えてくるんだもんね…
るしあちゃん…コンビニ2ダッシュお疲れさまだぁ…


ずっとそばにいるよ:_きゅん:
大丈夫、ぼく粘着質だから！
るしあちゃんが離れてって言うまでずっとそばにいるからね。"
UgyCbXMBkfIg8VCZo0B4AaABAg,1617235200,The WanderingWind,7,My face hurt. I was smiling alot watching you fangirl again! I LOVE YOU SO MUCH RU-CHAN! You are so sweet! See you again soon love! ❤❤❤❤❤ Thank you for the stream🙏:_るんるん::_きゅん:
UgylKICyPLSUcq6Wn5x4AaABAg,1617235200,もぶㄘゃ,8,"天井まで課金したとしてもお目当ての子ゲットおめでと！ウマ娘の世界観に入って寸劇するのほんと面白かったw
今日も楽しい配信ありがとうね！一生傍にいるよ！"
Ugz8K9-gQcB32oQvhTR4AaABAg,1617235200,バタモン╰ お兄ちゃん,2,"これからもずっと応援してるし、ずっとるーちゃんのそばにいるよ(むしろ居させてください)



2:29:44 自分用"
UgwwR5JNVHO0yf3JmER4AaABAg,1617235200,おぼにゃ〜だ〜!,9,"概要欄見たらなんか
サマーウォーズを思い出したの
俺だけ？"
UgxF4qBuR5J1CX8T30V4AaABAg,1617235200,Oreo,0,Rushia is so small
Ugyp8j5w3QzmLh4EQVN4AaABAg,1617235200,リアルころさん,0,ゲートからみこちがにゃっはろ〜って出てきたと思ったら、ハルウララさんじゃないですか‼︎
UgyTH--JZKHcgjO-XI54AaABAg,1617235200,SupaGoGoMan,23,Gacha claims another soul
UgygVZeit9UXq9QfN8t4AaABAg,1617235200,よしお,0,"おつるしー
ソシャゲのガチャこわいねぇ"
Ugzs_FQAVBRSMnBBpjV4AaABAg,1617235200,"fire,",1,"覇王さまゲットおめでとう！
ガチャ配信だけで色々起こりすぎてて凄い楽しかった！世界観に入り込んでるるしあちゃんかわいかった！"
UgyABMg7AVjNTB1Ox1l4AaABAg,1617235200,Doro,1,Welcome to Gacha hell Ru-chan
UgzqqsqEUldv7WRnvFp4AaABAg,1617235200,Saku,0,♡
UgzqqsqEUldv7WRnvFp4AaABAg.9KYQc3jK-Nu9KYm_vyhhxB,1617235200,Kuro Usagi,0,.
