id,timestamp,author,likeCount,text
Ugy4q5oM5t_A_YtgpQN4AaABAg,1648738594,グラヴィi,0,サムネ悪意あるww
UgwLSmmsLV6iEH0XvBt4AaABAg,1648731600,仮面ライダーKG,0,今までありがとう……るしゃ
UgzuhU1NeGKlLfRiSv94AaABAg,1648720800,ঐ£Røšê£ঐ,0,見れば見るほど「絵」ってだけなんだよなぁ😅
UgzsE4Rvb5IfzuAMthh4AaABAg,1646092800,고길동 gogildong ゴギルドング,5,"Thanks to Rushia. We realized what happy is.
There are so many people in Korea who love you!
Dont be so sad We are always on your side!"
Ugyu4JJ5vZRN7yZTU-J4AaABAg,1646092800,yameteee~,0,I love you rushia!!!
UgwTm3KaMXYa1Wa8AUF4AaABAg,1646092800,ラブカ,19,サムネ一瞬子作りかと思った
UgwTm3KaMXYa1Wa8AUF4AaABAg.9YjIoWmSjmq9ZZD2Lad-0d,1647561600,シミラー,1,"？？？「子供できちゃった」
？？？？「...」腹パン"
UgwTm3KaMXYa1Wa8AUF4AaABAg.9YjIoWmSjmq9_EMCx3uL4C,1648720800,ঐ£Røšê£ঐ,0,"るしあ「子供出来ちゃった」

まふまふ「...」腹パン"
UgzHO5n3HU0IA531oxN4AaABAg,1646092800,るしあ おそ,2,"そしてまふまふと
子作りするんですね、分かりますよ"
UgzHO5n3HU0IA531oxN4AaABAg.9YfOB5EEZxK9YpE7nj4N9h,1646092800,Aria Walker,0,クビになったし本当にするかも笑
Ugx2zszLeuKtPWQEisx4AaABAg,1646092800,Not A Good Guy,0,"なんか突然ここを思い出した。
パンケーキ一番綺麗じゃないでも作った人の思いは感じれる。大事なものは目に見えないかもね、君がくれたものが嘘ではないよ、なんだろかはっきりで言い切れないけど僕にとってあれが大切なものだよ、全部ね。
本当に君のことが大好きだよ。またクリスマス一緒に過ごせたい…まだるしあちゃんを勝手に彼女で扱えたい…また毎日楽しいで居たい…！もっと一緒にいたいよ…！
何のために生きるかわからない…でも共に生きろうよ…生きる理由を一緒に探そうよ…！"
UgwdaKbLbsHPgJDzmRl4AaABAg,1646092800,That Time I Got Reincarnated by 🦋🦋,0,Belated Merry Christmas Rushiaaaa 🎉❤❤
UgzF8fpYL-uUqfyqB8B4AaABAg,1646092800,横山昌人,0,"るしあちゃん、お料理上手だな〜
こんな彼女、居たら最高のクリスマスプレゼント！"
UgyyHszYm9iQYKdmXRt4AaABAg,1643673600,Vermilion,2,2:24:53
UgzRXXsrfaKPJHptLdJ4AaABAg,1643673600,キャロットマン,2,子作りって見えたのは俺だけじゃないはず…
UgwcCnARO0iIbZ9dtyJ4AaABAg,1643673600,虎岩琉生,1,サムネの文字を縦読みにしたら子作りって読んでしまうなど誰も言ってない、、、言ってないからな
UgzolugNh0tCuzQC6Jt4AaABAg,1643673600,WF-1000x,3,子作りXmas。狙ってますな
UgyGE4KDSaUl2QQmmDJ4AaABAg,1643673600,百鬼組の高校生,2,"サムネ縦読みした人おる？
心が汚れているからかな"
UgxFz_2ZZBCOzTbwuAJ4AaABAg,1643673600,poko Tsuyo,3,サムネが子作りに見えて一瞬焦った
UgxcywSzL-5tLIg_Qnh4AaABAg,1643673600,うめめ,2,サムネが子作りxmasに見えて、攻めたタイトルだなと思ったら違った
UgxvnJSC_VrWkC_2eLl4AaABAg,1640995200,Aki,1,サムネ縦読みしたら、子作りって書いてあって一瞬ビビった🤭💦
Ugxhg2OjzpU2b1APOzB4AaABAg,1640995200,ピー太郎,1,"サムネのお菓子作りが子作りに見えてちょっと興奮した。




ごめんなさい。"
Ugx3c12LgjZUAqylRnB4AaABAg,1640995200,お味噌,0,"1:01:14ピカソww
ゲルニカかな？ww"
UgxNQTCXyXLwzD_whGh4AaABAg,1640995200,あさかぜ,6,"申し訳ございません
サムネが子作りに見えてしまいました"
UgxNQTCXyXLwzD_whGh4AaABAg.9WUjZcc_02M9WX1atZwwOX,1640995200,クロスビー,0,今ちょうどそれ思った
Ugx8g7ahEk67vmXsfQd4AaABAg,1640995200,David,0,POG
UgxSUoUYNYHNsEusR2l4AaABAg,1640995200,白瀬,5,ごめんなさい、サムネがパッと見子作りに見えてしまいました。大変申し訳ありません
UgxSUoUYNYHNsEusR2l4AaABAg.9WUHp2YMPPu9WZh6W57aax,1640995200,I'm ringo_ You're banana,2,確かにそう見えなくもなくて草
UgyiJQcM96YAlvCG4Gl4AaABAg,1640995200,Joe Otaku,0,Kawaii✨🦋 but still fla-
UgxMYTgxzL6vAy5cOEh4AaABAg,1640995200,たけうち,3,サムネ子作りにみえた
UgwGp5x104WDjID3rIh4AaABAg,1640995200,こしあん,0,ふわふわの耳飾りがすごく大人っぽくていつもと違って新鮮だった終始可愛くてヤバかった:_きゅん:
UgxMXHoBzmsl6ACPFCp4AaABAg,1640995200,くらなさん,3,ほんとにごめん。サムネ一瞬子作りに見えた
UgzZt_KQcfrOZfH-gl14AaABAg,1640995200,カルボナーラ,2,サムネ草
UgwQTf8cSjWc8pJgiBV4AaABAg,1640995200,Eshki123,0,Ooooo her hair like My Fair Lady- Audrey Hepburn so cute!!!!
UgyP8Mw8I0Uir9BmQpx4AaABAg,1640995200,暗黒魔界のぉぉおおお ぉおぉぉおおおドラキュラデーモンサタンでびるショー君草www!!タマネギかw何,0,おつかれさまあああ😄😄😄😄😄😄😄😄😄😄😄😄🤣🤣🤣🤣🤣
UgzsqNC6xZ3feupyJhZ4AaABAg,1640995200,깡쉘 KS,0,"2:24:52 

1:30:30
save"
Ugx1-hwM0hQt4lLGHhx4AaABAg,1640995200,劉秉豐,0,我也有過抑鬱症  心情不好時可以出門曬曬太陽或是散步  如果真的不想也不要勉強  大家都會體諒你的  加油
UgyPGgkz_zqp-7QpgKt4AaABAg,1640995200,ソーシャル伊藤,2,お菓　子作り(〃ω〃)
Ugzw5G8OXCSy9mzhkFF4AaABAg,1640995200,貔,3,サムネ子作りに見えた()
UgwEWGdYFm1eRDK99Wt4AaABAg,1640995200,TheAkaoni00,2,サムネのお菓子作りが子作りに見えた俺は穢れている…
UgxD0qMUYFovqsuBjgZ4AaABAg,1640995200,Nezum1ねずみ,2,サムネ…子作り？？…
UgzmFlrxmOy_6u3rYI94AaABAg,1640995200,unown,0,Rushia with her hair up cuuute!
UgxVvNZ6iUSA8Ji7njx4AaABAg,1640995200,天蒼,0,要好好休息 ，注意健康
Ugyhy0dICS-iLBm52hR4AaABAg,1640995200,たいちゃん🍍,2,お菓子作りが子作りに見えた俺を誰か殴ってくれ(꒪ཀ꒪)
UgzPJYzw4_0mQ5pk9aV4AaABAg,1640995200,カメ ハメハ,2,子作り…
Ugy6pCGGYjQ0eRnKy0Z4AaABAg,1640995200,眼帯 ちひろ,2,サムネ子作りに見えた
UgyL-l3e3UqLs_wozqN4AaABAg,1640995200,donaco.どな子,0,"おつるし
パンケーキ作りうまくなってる！
ダークソウル実況あるといいな～　アーカイブが残ってないので"
UgxRbRixs9UcY-fKamp4AaABAg,1640995200,ちゃんりぶ,0,我が子を見守る親の気持ちってこんなかんじなんだなぁ…
UgxrkNYFd1ROz1qOqjp4AaABAg,1640995200,自由の神,2,"おか
子作り
に見えた"
UgzeAWQHtPOal9Hfxxd4AaABAg,1640995200,ふぶき姫♪,0,とにかく可愛い!
UgyK_qO6dfIPZxXKT9J4AaABAg,1640995200,蒼い鳥,0,"おつるし〜
ベリーショートお姉さん感があり
とっても素敵で似合ってて可愛かったよ！:_きゅん:
パンケーキ、前回よりも上手く作れてるよ！
他のお菓子に挑戦してる姿も見てみたいな〜
次回も楽しみに待ってるね♪

脂っこい物を食べるからお腹の調子を悪くしちゃうのかな...？
お粥とか皮を除いた鶏肉などの脂質が少ない物をオススメだよ。

ギリギリまで頑張っていると、更に身体を壊して
長期休暇を取らざるかもしれないから、
限界の2歩手前くらいまでにして欲しいな〜って思う。
でも、みんなや自分の為にギリギリまで頑張る
るーちゃんも大好きだし応援してるよ〜:_サイリウム碧::_きゅん::_サイリウム碧:"
UgxZHvQdqcPRXBFtGrB4AaABAg,1640995200,Exitium Ch. 破壊,0,メリークリスマスるしあちゃん!!!!母が亡くなってからの1年間、私を幸せにしてくれたのは、あなただけでした。また、私は大学生で、パンデミックの影響で実家に帰れないため、アパートで一人暮らしをしています。だから、こんな状況にもかかわらず、私を幸せにしてくれたことに、ただただ感謝したいのです。 これからも、人々を幸せにするような仕事を続けてください ♥️
UgzjDcSdiesX8Mvlich4AaABAg,1640995200,陳佳欣,0,メリークリスマス
Ugy7zNROsP0Uj-Q2xSh4AaABAg,1640995200,陳佳欣,0,Merry Xmas to cute聖誕快樂
UgyrfnypZYlQVyq8p6N4AaABAg,1640995200,ユエシンリーYueh Shing Lee,1,自分用 2:40:23
Ugzgk7zunnLadlu1VyB4AaABAg,1640995200,明日から本気出す,3,"サムネのお菓子作りが…












子作りに見えたw"
UgwqcEk6wRgtYvKcmMt4AaABAg,1640995200,ふぁんでっどA,0,52:30
UgxCk2VMCXHZixc0dMN4AaABAg,1640995200,鳥白魔道士,2,サムネで、子作り!? ってなるw
UgwtkrXCuP2JThjlJ4N4AaABAg,1640995200,おたふく。,0,クリスマスという特別な日に大好きな人と一緒に過ごせて幸せだったよきゅん今日のためにオシャレしてきて会いに来てくれて嬉しかった！ショートるしあどストライクすぎてヤバい...てかデートのためにオシャレしてくるのも可愛すぎてキュンキュンしちゃう...:_きゅん:外のリア充共に俺の彼女はこんなに可愛いんだぞー！！って自慢して回ってくらい🥰 来年のクリスマスも一緒に過ごそうね！
Ugw4_FrpU84ZDAmQ--x4AaABAg,1640995200,ワラソティス,2,おつるし！！いつも頑張ってて偉い！昨日は一緒にお菓子作り出来て良かった！るしあちゃん大好きだ！
Ugx7ziiKwElgjd9pShV4AaABAg,1640995200,サラダにょー,3,"サムネ「子作り」に見えた俺はもうダメかもしれんね

クリスマスの呪いかもしれん"
UgyMRo6XASZDtttPRHJ4AaABAg,1640995200,ヘリコワイ,1,"Yabe
サムネが「○作り」に見えた・・・"
Ugw307LGHzGdOgfgE_94AaABAg,1640995200,RiKu,0,"おつるしー！！
髪型可愛かった:_きゅん:"
UgxAveSnAELUOIfKFLF4AaABAg,1640995200,ふぁーむ,1,サムネびびった
Ugw4DP6M6dZh49hPxjt4AaABAg,1640995200,だだだだだッ団子,2,サムネの文字がエッッな文字に見えたの俺だけ？（笑）
Ugwe_RwnEl_j29HirfN4AaABAg,1640995200,くろあ,1,"おつるし〜！
寝落ちしてて途中まで見てないけどアーカイブ見るね！
いつものるーちゃんも可愛いけど新髪型のるーちゃんマジで可愛すぎた！似合ってて最高だったよ！
ほんとにだいすき！配信してくれてありがとう！"
UgzE0ClQ1KZGGAtFiLZ4AaABAg,1640995200,あい,0,チャンネルから動画一覧みると子作り♡ってなっててビックリしたわ
UgyWjXQCDoBHJgpNDlR4AaABAg,1640995200,灰色の騎士,1,"仕事でリアタイ出来なかったけど
るしあちゃんの新しい髪型本当に
素敵で世界で一番可愛い(♡ω♡ )"
Ugz5w0gMR4JE845tCFp4AaABAg,1640995200,kanon !,1,子作りにしか見えない…あぁ心汚れてるなぁー
UgwZ3vVvoCraKGP53Tp4AaABAg,1640995200,Ro Ki,1,サムネ、○子作りに見えて本当に申し訳ないと思っている。
Ugz4ySYn9S6F7NW-Zpp4AaABAg,1640995200,イケてない赤ちゃん,1,サムネに子作りって書いてあったからビビったよねww
UgyaJa2LHVV2VG8mqZZ4AaABAg,1640995200,さんだらすけ,1,子作りに釣られてきました
Ugwaq8iQOrnqIP253V54AaABAg,1640995200,アネッ狂,1,タイトル見て如何に自分の心が汚れているのかよく分かったよ...
Ugxcdo9B-mywHdRrxAh4AaABAg,1640995200,レイシー,0,配信お疲れ様です〜仕事終わりにアーカイブで拝見してます！今日も可愛い！クリスマスの癒しです！！
UgwKq8iRM7wOSx229pV4AaABAg,1640995200,もとき,0,推せますね笑
Ugwn2EB9mXMA5lWA04F4AaABAg,1640995200,バタモン╰ お兄ちゃん,3,"おつるしだよ〜
新しい髪型すごく可愛かったよ〜
パンケーキも前の時より上手くなっててすごい！"
UgzFiEv-MenjgMnxFNp4AaABAg,1640995200,シカ金魚,0,お大事に。
UgyHwFlZWYnx4rUojMh4AaABAg,1640995200,たかなキャンベル,2,サムネを縦読みした私を殴ってくれ
Ugws6opCq-MSzj6vPmZ4AaABAg,1640995200,茸田ロートレク,0,ショートカットるしあ！だいぶ早い段階で構想を練っていたって話からも、るしあの本気ぶり伝わってきた。今日は一緒にいられて良かった。まずはゆっくり体を休めてね。また明日！
UgycIfMceNVGsKUF7d14AaABAg,1640995200,ぽんた,2,スクロールしてサムネが流れてく時に「お菓」が抜けて見えて、えぇええ！？ってなったけどそんなことは流石になかった
UgxOkTtQjtcadLpPhMN4AaABAg,1640995200,Taranchura,0,Rushia short hair looks mature and cute
UgwshqQ6m_te9SZAqJl4AaABAg,1640995200,Arima Nauvaru,0,18:50 Yabee~
Ugw0LViXzOb41XhIkXV4AaABAg,1640995200,K. SK,3,"お菓子
       作
       り

二度見しました"
Ugxc4vxP43hRfBL8ChF4AaABAg,1640995200,Rokudo Damaza,0,KonRushi best boing boing necromancer!
Ugz2PbVCSvVH0V2vlMl4AaABAg,1640995200,tm sk,3,パッと見サムネに子作りと見えたので飛んできました
UgxLB0Wr86xkY19s5Ft4AaABAg,1640995200,西まんじゅう,5,サムネが子作りに見えた私は大罪人です。
UgwT9k-KwW3VtqmCkRx4AaABAg,1640995200,ボボ某ボ・某ボボ,1,"サムネびっくりしました。
これ以上のコメントは控えます。
ともかく最高でした。"
Ugx2N-N-Co2DfGtMXOZ4AaABAg,1640995200,玩家阿凯,0,Merry Christmas ! ! !
UgxiXW7Wr5W17xAPpBR4AaABAg,1640995200,たぬききつね,6,サムネが子作りに見えた…
Ugy9u8D1og3piOKuE7N4AaABAg,1640995200,がぶX_X,5,2:24:53 るーちゃんからのプレゼント🎁
Ugyk7eIfxNnWzHBBMkx4AaABAg,1640995200,ネオニダス,3,サムネのお菓子の子から縦に読むとアウトやんw
UgxowyOOMGfdpTMaM4l4AaABAg,1640995200,臙条巴,0,"配信間に合わなかった、、、🥺
アーカイブで楽しみますー！"
UgyFLWfyRSbFHg6DQCp4AaABAg,1640995200,猫はやと,0,は？かわいいんだけど
UgwHM8okwxmEVN4omTF4AaABAg,1640995200,西卡 CiKa,0,Short hair and this new hat is so perfect for Rushia!
UgyIoSqyXjdU7hTZ4op4AaABAg,1640995200,涅槃寂静どどんげ,0,るーちゃん可愛いのは当然として、サムネで子作りというワードが目に入ったのは内緒
UgzPfVnoy6cqnS2HEHR4AaABAg,1640995200,わん太郎,2,ショートの髪型も可愛すぎたしお菓子作りのパンケーキもめちゃくちゃ美味しそうだったし最高だった！素敵な時間をありがとうね！(๑ ́ᄇ`๑)
UgxvsXpr_goRLXwXKt14AaABAg,1640995200,ろいろい,0,"新しい髪型めっちゃ好きだ😌
帽子とセットでより可愛い!!!"
Ugyk1eNqCbEJPAikcvF4AaABAg,1640995200,ココアポッカ,1,おつるしー！新しい衣装すごく可愛かった！
UgydcISiTeWGVf6ExNV4AaABAg,1640995200,ごま,4,サムネ見て一瞬ダメな方に読んだ穢れた心でごめんなさい
UgwN19CDcbz6VeMmwZp4AaABAg,1640995200,KIRUA,1,"おつるし〜！
新しい髪型すごく可愛かったよ！
るしあと過ごしてる時間が本当に幸せ！
いつもありがとう"
UgwCYW4X73j1q7wmP254AaABAg,1640995200,くそ,0,おつるし〜 クリぼっち回避ありがとうございます！
UgyLbxQlvgsS_aeHXjN4AaABAg,1640995200,くそ,0,おつるし〜 クリぼっち回避ありがとうございます！
UgxA0c4_xa1t3u8qnTJ4AaABAg,1640995200,くそ,0,おつるし〜 クリぼっち回避ありがとうございます！
Ugx7oASbuEr_WM4eGeB4AaABAg,1640995200,12 12,0,おつるし
UgwUtQsX6ifiloArWER4AaABAg,1640995200,ワールドヴァンキッシャ,15,お仕事でリアタイで見れなかったけど、新しい髪型めっちゃ可愛い！耳のもふもふめっちゃ良い！！帽子のチョウチョもめっちゃ似合ってる！笑ってる顔が1番素敵だよるーちゃん❤
UgwHRWad_BrK_1663N54AaABAg,1640995200,アリス,0,ショートヘアー可愛いやん。いいね
UgwEBFRbVfsKuUqVPpR4AaABAg,1640995200,とーま【犬もどき】,0,"配信おつるし！パンケーキ作りから、髪型お披露目までずっと楽しい時間を過ごせました！クリスマスが久しぶりに悪くないなって思えたことに感謝しかない:_大泣き:
体調はゆっくりでも良いから一緒に治していこう。番犬からサンタさんにもお願いしておく！U・x・U"
Ugxhx_dGWfnPcIf2UFR4AaABAg,1640995200,あなたの隣人カイ原田,2,サムネ縦読みして「るしあ！？」ってなったわw
UgwqqVqzQ5135NEpe5N4AaABAg,1640995200,時々,0,"メリークリスマスイヴ！！
お仕事で見れなかったので今からアーカイブみるね！:_きゅん:"
UgyzYA2pNHV5-zCaoiJ4AaABAg,1640995200,くしきかくよー,2,"新髪型めっちゃかわいい！
パンケーキの絵も可愛かったぞ！"
Ugx1c56u3G8Go5VRlTR4AaABAg,1640995200,きのこ,3,サムネがセンシティブに見えてしまったのは俺だけか？...俺だけかすいませんでした
Ugx0Y19fPGmPb5lzWl14AaABAg,1640995200,ゆう,3,"俺らは心が汚れている、、、
サムネをみて2つの言葉に見えた、"
UgyqEaBi_BpG1SZRNL14AaABAg,1640995200,しんでぃー。,0,"おつるしよぉ～！！！
今日はるしあちゃんとクリスマスを過ごせて本当に幸せでした:_きゅん:
しかも…一緒にお菓し作りデートだなんて、、、
一緒に可愛いパンケーキも作れたし、
さらにさらに、ベリーショートヘアーるしあちゃんまじで似合うし、まじで冗談抜きで可愛すぎんよぉ:_おこなのです::_おこなのです::_おこなのです:
個人的には1番このるしあちゃん好きかもしれん…。
本当に今までにない素敵な思い出なりました！本当にありがとう:_きゅん:

ご両親様の話も聞かせてもらってすごくほっこりしました(*´ ˘ `*)
より、るしあちゃんの優しさや、ご家族想いの素敵な子って改めて実感しました。
当たり前のことかもしれないけど、ちゃんとやってあげることが中々できないし、本当に尊敬します。
これからもご両親様のと仲良く、そしていっぱい親孝行してあげてね！！！

今日は本当に素敵な時間ありがとうね！
体調悪い中でも本当にありがとうね(´；ω；｀)
ゆっくり休んでもらって明日また会おうね(*^^*)
るしあちゃんに会えるの楽しみにしてます！
ではでは、おやすみなさい☆彡.。"
UgzS2FJOakoJ4lRbSjN4AaABAg,1640995200,中澤,1,"おつるし～
前回のパンケーキアートより成長を感じた所存
毎回丁寧なスパチャ読みありがとね
助かってんで"
UgwCmta5BS8a4LCACcB4AaABAg,1640995200,うすみどり,0,"メリークリスマスイヴ🎄✨
パンケーキお上手だったよ！
ふぁんでちゃんもるーちゃんも味わい深い良い出来でした！
新髪型もとってもかわいかったぁ！
この日のために前から用意してくれていたって聞いて本当に嬉しかったよ！
最高のサプライズプレゼントと素敵なクリスマスをありがとう:_ハート::_きゅん:"
Ugx9jegq2VlVUwFrELd4AaABAg,1640995200,ごっつ,3,サムネ縦に読んだ人はおれだけじゃないはず
UgxpE2qZI0gk0tCDTAB4AaABAg,1640995200,Yoshi,3,サムネを縦読みで子作りって読んだ自分を誰か裁いてくれ
UgxjaLXNHMjofB6Nm1l4AaABAg,1640995200,ymamon55,3,サムネ見て子作りかと思ってめっちゃ焦ったわ
UgwbzhkhNCStOrgWQdh4AaABAg,1640995200,ご飯食べたいなやっぱりパンかな,5,子作りに見えた俺はヤバいのか
UgwTsLHqQHsw-6PlrRB4AaABAg,1640995200,Paru,0,"おつるし！
パンケーキアートとっても上手だったし、可愛いかったよ！
髪型もロングとはまた一気に雰囲気も変わって凄く可愛い！！
今日はとても幸せで最高のクリスマスイヴになったよ！ありがとうね！"
Ugw5M6HkcHd8dLEtcqZ4AaABAg,1640995200,LAWそん店員ﾔｯﾃﾏｽ,1,今度僕に作ってね♡
UgyPP1DDQcDzaJLoYv94AaABAg,1640995200,宇治抹茶,1,"今日の放送も最高でした🥰
なかなかリアルタイムで見れないので観れて嬉しかったです🥰
るーちゃんはしっかり休んでね🥺"
UgzOrvGNPJU-Yd4mngV4AaABAg,1640995200,holoカプ,2,"メリークリスマス！！
新しい髪形もすごくかわいかったです:_きゅん:
体調が良くなるようにいっぱい休んでくださいね:_あせり:
るしあさん、大大大好き～:_ハート:"
UgwwSIGXfsib2hf9I_14AaABAg,1640995200,れくいえむ。,3,サムネ子作りに見えた
UgwIPl_Chd6iv8bEofN4AaABAg,1640995200,armoredGolem,0,OtsuRushi~:_ハート:
UgyjCGdvE1UwCgiOy1p4AaABAg,1640995200,エディション Believers,1,"おつるっ~！
めっちゃ楽しくて、幸せな時間を過ごせたよ！お菓子作りデートとても良かった！ゆっくり休むと良いね！ありがとね"
Ugxfem6gtZF2l9lWG7F4AaABAg,1640995200,ぜりー,0,"パンケーキアートめっちゃかわいくできてて凄い！
ショートもベレー帽もめちゃくちゃ似合ってて、るーちゃんがますます魅力的になっちゃったぜ…
俺らの彼女、かわいすぎ:_きゅん::_ハート::_猫耳るしあちゅう:
体調良くないのに会いに来てくれてありがとうね！おかげで素敵なクリスマスになったよ:_きゅん:
一生忘れないかんね！大好き！"
UgyvI8nvI2dIWGBe9r94AaABAg,1640995200,凜祢,1,"おつるし:_きゅん:
今日はるしあちゃんと過ごせて最高に幸せな1日になったよ(* ´  ` *)ᐝ
ショートもめっちゃ似合ってた！
かわいい:_きゅん:
パンケーキもかわいくできてたよ！
成長を感じる:_るんるん::_るんるん:
今日はゆっくり休んでね(><)
早く良くなりますように！
明日に備えてゆっくり休んでね！！
今日はほんとにありがとう！
大好きだよ。お休み:_猫耳るしあちゅう::_猫耳るしあちゅう:"
UgwfeQ4ZoWKkJJiEBGB4AaABAg,1640995200,フンボルトG,3,サムネ見てびっくりしたけど、お菓子作りか
Ugx-nmHiXJUiZjiDLeV4AaABAg,1640995200,ゲン,0,"新しい髪型凄く似合ってたよ！
お菓子も上手にできてさするしだ！今日も楽しかったよ"
UgxX1FM9vsTy7nZo6JR4AaABAg,1640995200,ヘム(urh),0,"るしあちゃんと過ごすクリスマスも今年で３回目！
大好きな人との大切な時間は、かけがえのない幸せだよ:_きゅん:
ま、個人的には""まだ""３回目なんだけど (・∀・)
もっとずっと一緒に過ごしたいからね:_るんるん:

ショートの髪型もすごく似合ってて素敵！
美味しそうなパンケーキと最高の思い出を届けてくれてありがとう (*´꒳`*)

体調には気を付けて、休めるときにしっかり眠ろうね:_猫耳るしあｚｚｚ:
大変な状況でも俺らを気遣ってくれてありがとう！
俺だって、いつもるしあちゃんに寄り添ってるからね。"
UgzAxyzPMSxszHf4beR4AaABAg,1640995200,門,0,"いつもは可愛いって表現が合うけどショートは綺麗って表現が合うイメージ
ずっと前から企画準備して頑張ってくれてありがとう:_きゅん:
パンケーキ作りも上手くなってる！🥞
無理はし過ぎないようにね、体調第一:_ぴよこ:"
UgwusBnhaiUzjqqqFlB4AaABAg,1640995200,ニノニノちゃん,2,"おつるし！！
新しい髪型凄く似合ってて可愛かったよ！
パンケーキも可愛くて良き！
るしあちゃんと今年もクリスマス過ごせて良かったよ！
来年も一緒に過ごそうね！ありがとう！"
UgwusBnhaiUzjqqqFlB4AaABAg.9WKuShUuTaD9Z-fm6Zjv3K,1646092800,𐦝,0,We failed...
UgyA1wP18eo2h7KR-1x4AaABAg,1640995200,みるまる,4,サムネ子作りにしか見えんのやが
Ugzs8zqWgsgbuvpSEUB4AaABAg,1640995200,なの,0,"メリクリ！
るしあちゃんの過ごすクリスマスさいっっっこうに幸せだった…
こんな幸せなクリスマス初めてだあ…
ショートめちゃくちゃ似合ってて可愛いよ！ぎゅってしたくなる！

パンケーキもありがとね🥞
いただきますŧ‹”ŧ‹”( ‘ч’ )ŧ‹”ŧ‹”

今日は本当にありがとう
無理せずゆっくりやすんでな〜

大好きだよ"
UgxVd1zp_GeeWuhaKrN4AaABAg,1640995200,日本銀行国庫局、専売特許許可局,2,サムネ子作りに見えてビビったんだワ
UgxonFC7W1LZkzKzELF4AaABAg,1640995200,エムアール🦋🐈,1,"おつるしなのです

自分もクリスマスイブの今日に鼻詰まりと頭痛が痛くなったもんで少しばかりキツいてなもんです。
明日の歌リレー楽しみにして体を休めようと思います。おやすみです( ˘ω˘)ｽﾔｧ"
UgxsolPjJBmGBOVvx3t4AaABAg,1640995200,マサラ人サトシ,0,"おつるし！
パンケーキ作り上手くできて良かった:_るんるん:

体調悪い中丁寧にスパチャ読みしてくれてありがとう。自分の体調を優先してゆっくり休んでね:_るんるん:"
UgxlsETriad_6vBS2DR4AaABAg,1640995200,Zein,10,"Today was a lot of fun! Thank you, Rushia!
Your new hairstyle is super cute! I love it!:_きゅん:
Merry Christmas! I love you!"
UgzMUZL6-Uznk-c-krR4AaABAg,1640995200,がぶりちゅう.,1,"ハッピークリスマスイブ！:_猫耳るしあちゅう:
るしあとイベント時間を過ごせて本当に幸せだなぁ
お菓子作り上手で、色んなやり方を思いついててさするしだった！
これからもたくさんの思い出を作っていこうねっ！"
