id,timestamp,author,likeCount,text
UgxHui2Tj8bMsFZVPdd4AaABAg,1648738140,mayu,0,"ありがとう　お疲れさま
いつも楽しませてくれてありがとう
星羽好きだったよ"
Ugzj8t-rPPLEMv6SfAp4AaABAg,1648717200,パルン,0,るしあありがとう
Ugwb2Z7TXCdlVVks9T54AaABAg,1646956800,IdenityX Unknown,0,"Drawing with Rushia and Suisei :_るんるん::_るんるん:, COVER CORPORATION PLS DON'T DELETE RUSHIA YOUTUBE CHANNEL:_大泣き::_大泣き:

I've literally don't have much to say , because firstly I don't understant Japanese , Secondly I don't understand what are they drawing , so R.I.P my brain :_ドクロ::_ドクロ:

To Rushia : Starting to learn Japanese now using an app call Duolingo , hope that one day I can watch your stream without translation:_きゅん::_きゅん:"
UgzJ0tH1nSU6nyNu2JF4AaABAg,1633046400,Ricky,3,39:57ここ好き
UgxggXU9XITNxqciGPB4AaABAg,1630454400,donaco.どな子,2,1:03:08 笑い声がとても楽しげで癒やされる
Ugy6Kqcd8Vv-rwzPqfp4AaABAg,1617235200,Hyper Miracle Positive Girl,2,Cutting board and a knife in a relationship? Now this is perfecto
Ugy6Kqcd8Vv-rwzPqfp4AaABAg.989q1M0Xxhn99DqErEhxM7,1617235200,zachy boodles,0,"この無礼なコメントを翻訳します。エヘン、
まな板とナイフは仲いいって？これはこれは完璧じゃん。"
Ugx6tcHlIq8TtSQPdQB4AaABAg,1617235200,ペマまー,0,ワイはてぇてぇ耐性−147852369を手に入れた
UgwWcyj3GMsYFs2CleB4AaABAg,1617235200,Mr.PereNoel,2,"1:04:23
Kore ga... Requiem... da"
UgylIMh6P-MftWm6hYF4AaABAg,1617235200,Ratt,0,everyone want to tease rushia becouse cuteness reaction lol
Ugzf2c5ZJaMFDoxDCKN4AaABAg,1617235200,春菊,7,"12:45 伏線
49:50 回収"
Ugzy1nxKgn93p3vJojh4AaABAg,1617235200,創英角ポップス,0,このこかわいいね
UgyKJ3wiqp6xCdr9gpR4AaABAg,1617235200,ざいきつ I Su,0,Board Chan
UgwxX2qIfJ7tGyDC2Zx4AaABAg,1617235200,Seiza,0,Sui-chan sniff... I have ascended
UgzaiU1K3SeSKBCFJlh4AaABAg,1617235200,げんや,0,"何がとはいわないけど、ぺったんこな二人すこ。
すいるしてぇてぇ。"
UgwmkMMDOomO7a67-z94AaABAg,1617235200,暇時free,0,"乙るし！
いや～るしすいてぇてぇですわぁ～
今日もるしあちゃんとすいちゃんは～かわいい‼️"
UgwGpVb7cXcNxzQ-9mt4AaABAg,1617235200,Alex,0,Had to go early rip but it was fun
UgyeZCs01R3ciZxLdmB4AaABAg,1617235200,夏の秘密基地,18,"51:25
あ～～
年が2個上のお姉さんアイドルすいちゃん　×　影のある年下美少年駆け出しホスト、ルシファア

幸せな二人、彼はやり手の海賊ホストクラブ店長、ジャックにその才能を見出だされた。
同僚、３輝星の支えとそのイケメンヴォイスで夜の街をホストとして成り上がっていくルシファア、、、しかしそれは同時に表の世界で光輝くアイドル、すいちゃんと離れなくてはならない事を意味していた。

夜の闇に染まっていく自分と彼女への想いに葛藤する彼が下す決断とは、、、

っていう所まで幻視させるやつ～"
UgyqclwH82_HiywclN14AaABAg,1617235200,BlazedCorn,0,"She is still cute and awesome. 
I hope ur safe.👌"
UgyLy2ylrdxgF3oFNbR4AaABAg,1617235200,ほわいとM,0,アーカイブでみたけど、最後のエグい…
UgxlLpNFIu7aTT9SQ2J4AaABAg,1617235200,るしりす,0,参加出来て嬉しかったよ！！ありがと！！楽しかったよん！！名前呼んでくれて嬉しかった！！  41:00
UgxUqjnRulDR7nFdqM94AaABAg,1617235200,アニメ推し【Vtuber好きな者】,5,"すいるしてぇてぇ29:42 
湯婆婆すいせい1:01:40"
UgypQ3NDCdEDDzvXrRB4AaABAg,1617235200,Mine Dyse,1,So happy to see Rushia chan being so healthy as always
Ugx0KoR-lAICjnvGHjp4AaABAg,1617235200,Mine Dyse,0,Gomen Rushia chan! Busy so I didn't watch this one ☹️
Ugyzoaf7-L4XMvHkpe94AaABAg,1617235200,なべこ,0,最後で吐くほど笑った😃
UgxqZ1A284EB2IOHLSB4AaABAg,1617235200,夜勤りん ご,0,終始楽しそうで、最高のコラボ配信でした！またこの2人の暴走が見たい！
UgxR6SJrHaEb8FXmcdV4AaABAg,1617235200,ターキー,2,1:01:35 予想を遥かに上回るすいちゃんのモノマネ
UgxBCBWR3vddJyBLcxB4AaABAg,1617235200,にっさん,0,"最初から最後まで2人が仲良しでずっとニコニコしながら見てたよ〜！
BLで沼が出てきたりるしあちゃんが限界迎えてる所本当好き！
今日も配信してくれてありがとう〜"
UgyZd0XEKERGI06L4O14AaABAg,1617235200,제츠나-ゼツナ,0,おう。。好きな二人がいっしょにｗ
UgxDk04gOkTjFD56jYJ4AaABAg,1617235200,Sounds Channel,1,bring back penta!
UgyezctW7PUaH8jtaFB4AaABAg,1617235200,HAKU（ハク）,0,アーカイブ見ることになったとはくそ…完全に僕はアーカイブ勢、やっぱり間に合わなかった…
UgzAiTxnbQsByQJmEAh4AaABAg,1617235200,みしらぬネコ,5,45:15～ ルシファア
UgzHBQWDLDGnhqtX_7d4AaABAg,1617235200,ちょむ,5,"44:45 ルシファア様！？
てぇてぇに尽きるコラボだった楽しかったよ〜
限界迎えてるるしあちゃんかわいいぞ"
UgzA3CqBfm9kl8kewWV4AaABAg,1617235200,ぬっこ,1,"0:00〜1:05:07自分用
おつるし〜　ライブ間に合わなかったですが、こんな自分でも許してくれますかね？涙"
Ugy-tauXOpQwgHpUmQt4AaABAg,1617235200,誰か,0,"すいちゃんの宣伝👍＾＾
こんるしせい。おつるしすい。＾＾"
UgwANdapXO_k9cayyGN4AaABAg,1617235200,登れない坂道,1,双方どちらかの推しであれば上半期一番レベルのてぇてぇだったのでは？最初から最後までてぇてぇでよかった。きららアニメ見てるみたいだった。おつるしすい☄️🦋☄️🦋☄️🦋
UgxQOtbLwiJA7PEivox4AaABAg,1617235200,ょゎぃゃっ,0,対戦ありがとうございました〜
UgyxNYZm9WOKc36IMMB4AaABAg,1617235200,taeng kkura,6,49:35 😂
UgyKOhNClle32gW0vS14AaABAg,1617235200,Darkmoonice,15,1:04:31 attack of the rushia clone wars
UgzOeXDaftCaoqxrutd4AaABAg,1617235200,たそ丸,17,39:58 kiss
UgzOeXDaftCaoqxrutd4AaABAg.98-DGyfa3Qa980DBOJJr7e,1617235200,水性マジック,1,あかん、これはガチのてぇてぇ
UgyRYEnA3ytDK0O_If14AaABAg,1617235200,藤咲凌,0,"るしあちゃんとすいちゃん本当にてぇてぇ✨
終始ニコニコしながら見てました！
2人とも仲良しで見てて癒されるし話聞いてて楽しかったよ！
とっても素敵な時間が過ごせました！
ありがとー！"
UgzL0jUbLuhK_Z9Rmyd4AaABAg,1617235200,じょん,0,"めっちゃ楽しかった！
るしあちゃんの珍プレイ？にはめっちゃ笑いましたｗｗ
2人ともありがと～"
UgyaNTY56eC3biqALsB4AaABAg,1617235200,守名しづき,13,29:40　暴言+てぇてぇ=ツンデレ
Ugz-aDtsveq7h5tpvdt4AaABAg,1617235200,Hirotein,11,"すいちゃん今日もかわいい！！
1:00:00 最後のモノマネで笑ったｗ"
UgzA94jERXAIdktqyoB4AaABAg,1617235200,はらぺぇにょふらぺちぃの,2,"この一言につきる…



てぇてぇ"
UgzG_PyhGQBS7Hk3Xcx4AaABAg,1617235200,GravityHurts,4,"22:35 Is Rushia drawing Gordon Ramsay on one of his show judging some dishes? Lol

Thank you Rushia and Suisei for the fun stream <3"
UgzG_PyhGQBS7Hk3Xcx4AaABAg.98-C0XAHIQD98-HZYVoh5E,1617235200,Sounds Channel,2,GravityHurts there are others chefs in the UK other then gordon ramsay you know
UgzrK8Cuse0gb4LWsi94AaABAg,1617235200,M初老爺,2,最後カオスすぎて笑う
Ugwl5mhPQB72jPCUYZ14AaABAg,1617235200,FNZ 2017,2,Such a fun stream Thank you for today! 🙏🦋
UgwsoPmJTXaVt-i0lb94AaABAg,1617235200,SIYテック,36,1:04:31 ゴールドエクスペリエンスレクイエム喰らったるしあ
UgwsoPmJTXaVt-i0lb94AaABAg.98-9rVBzY2J9898fDlVLkv,1617235200,許さん,0,これが、レクイエムだ
UgygsuiZ_9BVPFFe54t4AaABAg,1617235200,サクメジラ。る,0,今回は特殊な始まり方をして、特殊な終わり方をしたねw
UgxSI35jxUqdkHFdTKl4AaABAg,1617235200,LordOfLemmings / レミングの王,49,For English viewers possibly watching the VOD: They played Oekaki no Mori with viewers and whoever had less points had to do a penalty game
UgxSI35jxUqdkHFdTKl4AaABAg.98-9f0RFOvH98-iLmO9iFM,1617235200,BlazedCorn,2,Ok bro. Thanks for the info
UgxSI35jxUqdkHFdTKl4AaABAg.98-9f0RFOvH980EQzEZIAC,1617235200,Sean Ibarrientos,1,🙏🙏
UgxSI35jxUqdkHFdTKl4AaABAg.98-9f0RFOvH980X3iZXOri,1617235200,Frame S,1,Thank you so much lifesaver
Ugx72ZwVttGmIcmDzrN4AaABAg,1617235200,うべい,0,は？かわよ
