id,timestamp,author,likeCount,text
UgylUOCf90KvvtNAp1x4AaABAg,1630454400,アカイシ,22,朝からるしあ可愛いかったよ！いっぱい癒されたわw散歩中だったからあんまりコメント出来なかったけど配信はちゃんと聞いてたから許して！もぐもぐと歯磨きあざっした生活音も良かったw
UgxqzZoqPFuQ-m0eeux4AaABAg,1630454400,空零海ベル / Aomi Vel,1,:_おつるしのお::_おつるしのつ::_おつるしのる::_おつるしのし:
Ugxa-yel7_D7SU9hrdN4AaABAg,1630454400,ぷいぷい☆もるふ,5,"✨:_おつるしのお::_おつるしのつ::_おつるしのる::_おつるしのし:✨

朝からるしあちゃんの素敵な声が聞けて幸せでした:_きゅん:

ありがと〜！:_るんるん::_ハート:"
Ugys06Q1J4JCE74kziB4AaABAg,1630454400,キョロ,1,"おつるし～！
朝からるしあに会えて感謝感激雨霰！
寝起きのるしあかわいすぎんよ…
明日のコラボも楽しみにしてるで！"
UgxT4QaLwG02oTnOgUl4AaABAg,1630454400,ボリサムSam★,27,"30:30 私助かる Rushia's Watashi

でもそのあとゆっくりチェックした方がいいかも"
UgzAhb5owGAiMuFp74d4AaABAg,1630454400,ぽいまる,1,"るーちゃんおつるしです！
朝から色々ありがとうとてもかわいいるーちゃんが見れて幸せだよ！
美味しそうな料理と寝起きのるしあちゃんはとても破壊力があって凄く癒されました。
同時視聴も楽しみにしてますね:_ちょうちょ:"
UgwZxDuAcNOnu3hNm0V4AaABAg,1630454400,さるたろ,5,"久しぶりの朝活！！
可愛すぎて語彙力が無くなることが何回もあった…:_きゅん:素敵な朝食もありがとう！ゆっくり休んで明日に備えよー！"
UgxABL86WYzkA69Q2sR4AaABAg,1630454400,裏垢男子,2,楽しかった！！
UgwR2rgRU4s6lciFdml4AaABAg,1630454400,ゆーすけ ふぁんでっど,6,えへへ〜朝からるーちゃんに出会えて幸せだなぁ☺️☺️本当にるーちゃんが可愛すぎた！！おかげで顔のニヤニヤが止まらいw
UgwaL_4Kjyj5AjQamDt4AaABAg,1630454400,"fire,",0,"朝からるしあちゃんに会えて幸せだったよ！
寝起きかわいすぎ！好き！
素敵な1日の始まりをありがとう！
また朝活して欲しいな"
Ugz1oDfT7KPp6f6BOQp4AaABAg,1630454400,Noodle_Man17,2,Rip I’m late and fell asleep 🥺
Ugz0ydSuxFNG2-bzLoF4AaABAg,1630454400,Chung,2,:_おつるしのお::_おつるしのつ::_おつるしのる::_おつるしのし:
UgxBdOY--_cFIlrzG9Z4AaABAg,1630454400,candrii,2,Very nice stream today!
