id,timestamp,author,likeCount,text
Ugy_E_HvXZ4gPv3hsxN4AaABAg,1648717200,パルン,0,るしあありがとう
UgzWiYOwCa6v22cP4Th4AaABAg,1648166400,ゆり彦,0,ぺったん！　ぺったん！　可愛いなぁ
Ugy-vIoW1hdIbbEOWhh4AaABAg,1647907200,龍牙神,1,🦋
Ugy_qEH63Sj8Y7wDz2l4AaABAg,1646956800,로옥시,1,すぐ消えると思うととても悲しい。
Ugyyg9GRl0oBoQfpkQl4AaABAg,1646956800,まきずし,1,"おつるしるーじゅ！
はあちゃまとのコラボも見てて楽しかった！:_るんるん:
この時は清楚・・・清楚・・・:_やんでれ:"
Ugy_wdEPo45FklCKdrN4AaABAg,1646956800,IdenityX Unknown,0,"Two loli dating :_ハート:, COVER CORPORATION PLS DON'T DELETE HER YOUTUBE CHANNEL !!

《The date between pettan loli and boing boing loli》:_ぺったん::_くさｗ::_くさｗ:
(don't kill me pls:_しょぼん:)
Do be careful while exploring dark caves though :_あせり:
Two Stream in one day , mad respect o7:_きゅん:"
UgxeyGi9qbCvAtvUlVZ4AaABAg,1646352000,kenトリー,0,24:33 凄い事を思い付くるしあ
UgwVKMdDZUGc69FePEB4AaABAg,1646092800,Gaki B,0,<3
UgzEPGdQT3d_u0t7NT14AaABAg,1646092800,Gilberto da Paz,3,T-T
UgynOvy1r4akXm683cB4AaABAg,1646092800,Chris Lau,4,o7 the great old days...
UgzRikncCRRO2dBi7ad4AaABAg,1630454400,AHYAI,0,"はあるしコラボって…めちゃくちゃいいね…
(*´ `)♥️

自由奔放に振る舞うはあちゃまに可愛さを感じているるーちゃんが、ずーーーっとにこにこしててめちゃくちゃかわいい:_きゅん::_ハート:
やんちゃな子の面倒を見ることになった優しい近所のお姉ちゃんみたいw

たぶん妹とか弟とかいたらめちゃくちゃ溺愛してたんだろうなあ…(∩˘ω˘∩ )♡

笑い方がすごく優しくて安心する。
こんなお姉ちゃん欲しかったなあ…"
UgyJVvTTKevYgTEnovJ4AaABAg,1627776000,タイキチ,2,7:40 あ初期ww
UgwWNhNd-uOI3T30FHZ4AaABAg,1627776000,Cocailon ditconbamay,0,<3
UgwlYOXPimcap9tC-MN4AaABAg,1625097600,盛猫れのあいがん告白,0,:_るしあのる::_るしあの::_るしあのあ:請多多指教為了不被ふげだごばで告白の心情，希望:_るしあのる::_るしあの::_るしあのあ:每天可以たのし既使被:_るしあのる::_るしあの::_るしあのあ:ばれだ，請初見粉絲多多關注:_るしあのる::_るしあの::_るしあのあ:姊姊的誕生日。還有這是祕密，本人還沒知道請告知此留言。
UgwlYOXPimcap9tC-MN4AaABAg.9OWxrL2aRb99OWy2g_rwBa,1625097600,盛猫れのあいがん告白,0,:_るしあのる::_るしあの::_るしあのあ:誕生日1/22
UgyW_4bWqC0WVk3g6fR4AaABAg,1625097600,盛猫れのあいがん告白,0,"私目の:_るしあのる::_るしあの::_るしあのあ:是強大、きれ、さしん女性，どそ:_るしあのる::_るしあの::_るしあのあ:讓前輩心裏たのし、ぬれし陪同前輩出席分享這個いち年的各種參於直播對前輩の全員的感謝,わたしの誕生日4/18,:_るしあのる::_るしあの::_るしあのあ:喜歡你。這是對あなだ女性。請不要看這段對我有心意,あいしでる。請陪陪前輩們全員。"
UgxIB4SNCCQ-1h1dMuZ4AaABAg,1622505600,コメントだけで登録者500人を目指す,0,最近の切り抜きから来た
UgzuoIb2qzivAtKCkut4AaABAg,1617235200,Tusk 2,0,My kokoro itai
UgyzyM59gswqtEOw3yx4AaABAg,1617235200,Aetheral,1,Peak cuteness
Ugy-UWEvHPIpYZr5Z7d4AaABAg,1617235200,Alwyn Nito,0,Grrr!!!!! Please beware of strangers! Everybody!!!!
Ugy-UWEvHPIpYZr5Z7d4AaABAg.9HrkE80JqZC9I4Uv9ul5vP,1617235200,Aetheral,0,"Lmao,how did you end up here friend?"
Ugy-UWEvHPIpYZr5Z7d4AaABAg.9HrkE80JqZC9I4via1_-AT,1617235200,Alwyn Nito,0, @Aetheral   their anime channel?
UgzVepzTcJCG-3qcROJ4AaABAg,1617235200,LaTeF,0,2020 2nd Stage LIVE から来ました！2人の「夜に駆ける」最高だった！！！！！
UgxPRNQEWapu5MTf7Ch4AaABAg,1617235200,ななねこ,0,この時からダジャレ言ってたんだね。めっちゃ可愛いな！
UgzwclnjGPyYdgJLTZ54AaABAg,1617235200,そるてぃー,8,"限界るしあちゃんかわいいなぁ～
39:40 ファンデット襲来！"
UgztSFcdP4ua2u5GgDZ4AaABAg,1617235200,Wa Re,0,るしあちゃんめちゃ褒め上手ですっごいいい子で大好き
UgwtSwfFxJBBaw3tLzh4AaABAg,1585699200,kiyomaro takahashi,6,16:40 生命の誕生にツボるるしあちゃん
UgzVF7-Se9oNHZp0XVN4AaABAg,1585699200,Tyler Hensley,5,なぜ今、私の目から喜びの涙があふれているのですか？
UgwUmsHD_YMuCXVIdnt4AaABAg,1585699200,sanari0510,0,"すきすきムーヴしすぎて腐った肉まで食べててかわいい

さいかわコラボだった
おうち建設コラボたのしみにしてます"
UgxcqLrgl8oz331tcAx4AaABAg,1585699200,ぽんた中佐,1,"7:35 ぺったんに敏感なるしあちゃんｗ
16:00 容赦なく打ち首していくのかと思ったら...
24:27 ......
おつるしるーじゅ！
終始微笑ましい光景で最高でした"
UgzOSlUvrnUF3qnkj3h4AaABAg,1585699200,けろちゃん,0,"可愛いと言っているるしあの姿を見ながら、2人とも可愛いなぁと思い見てた。それなのに、「遭難だ」と「そうなんだ」って……。
ほんと、癒されるなぁw"
UgwEMpos8u_FYfVfdN14AaABAg,1585699200,にゃす,0,"ゲリラマイクラおつるしるーじゅ！
迷子にならなくてよかったぁw
てぇてぇ配信楽しかったです"
UgzwtgV9JDdL8uaSWiJ4AaABAg,1585699200,カゲロウ,0,てぇてぇすぎてずっとニヤニヤして見てた
UgwecY_5dZttKDORKkd4AaABAg,1585699200,はちみつと白湯,1,"おつるしあ～(´･ω･)っ🍮
今日は特にてぇてぇで癒されました。また見てみたいコラボです
ありがとうございます"
UgxM8D7d8Imw74mCq8V4AaABAg,1585699200,あまねこ,0,はあとちゃん海外だから若干声切れてるときあったけど 最高にてぇてぇだったな
UgyrkyW7PqESPy5W-2J4AaABAg,1585699200,TKG徹,1,"40:43
ゾンビスポナー"
Ugx6zPoSuTuzpqvApNF4AaABAg,1585699200,SSINN-シン-,2,"精神がいくつあっても足りない…
可愛いの波が押し寄せすぎた"
UgyTYLeUI5iRXqnSrFN4AaABAg,1585699200,ラフ・コフ,0,終始てぇてぇでした😇
UgyTYLeUI5iRXqnSrFN4AaABAg.90M44WHAlpU90MWUiZfEBg,1585699200,ラフ・コフ,1,今起きてるんですかっ！？夜更かしは肌に悪いですよ？
Ugyn-T_sCgwbGH-ggEp4AaABAg,1585699200,やまひげ,3,"おつるしるーじゅ！
2人のマイクラ楽しかったのです！"
UgzcQrlt0lslJj7DMtR4AaABAg,1585699200,紫橙翠狐,1,"なんだこの２人の組み合わせ。癒しの塊なんだがｗ
おつるしるーじゅ♪"
UgxLqENvuNAkl0G7UyZ4AaABAg,1585699200,てんゆー,0,"マイクラゲリラおつるしるーじゅ！
ちょっとした遠征からの洞窟探索でしたね
終始お二人可愛すぎててぇてぇでしたよ～
またるしはあお待ちしてますね"
