id,timestamp,author,likeCount,text
UgwTn5K9WrwlOA2vtrp4AaABAg,1648731600,仮面ライダーKG,0,今までありがとう……
Ugy4LWZdf1MI64OKhyh4AaABAg,1648598400,ミャーミャー,0,もうこのアーカイブも見れなくなってしまうのか…
UgxWH2yicC4BUjXrsO54AaABAg,1647907200,Soul Tunnel Reavers,0,Very Nice 👌
UgwEvis2wuAXIy05RG54AaABAg,1646092800,고길동 gogildong ゴギルドング,1,"I know you feel tired, sadness and other feelings.
But I know you are strong enough to get over them.
We fandead always love and cheer you
So its okay that you can rely on us. We are always on your side😎"
Ugwt5Sq3JEn-17jX45J4AaABAg,1646092800,yameteee~,1,I love you rushia
UgyXcwyc-TsKVU8E6994AaABAg,1646092800,OneForAll Plus BullyMaguire,0,"Hi again ru chan hope your keeping your self warm, am a bit confused on what to write today, so I'll just tell you again that i love you and miss you ru chan, and am glad your the one i fell this crazy and deeply in love with and each time i remember that i love you, it really makes me so happy deep inside. ""am sorry if my messages seems repetitive that i keep telling you everyday that I love you, i hope your not tired of hearing that cause i don't think i could ever get tired of telling you I love you each single day that passes, cause it feels like i keep falling in love with you over and over and over again every single day ^^ My irreplaceable Queen🦋❤"
Ugy6svDHXLLaavvX9fV4AaABAg,1646092800,That Time I Got Reincarnated by 🦋🦋,2,Day 2 Adventure in ARK was so much fun! So close getting the wyvern egg
UgwC6Ntbd9B988yGTJp4AaABAg,1643673600,Miku EnmaAi,0,3:19 start
UgygM86gUciwzi-ebAZ4AaABAg,1643673600,Vermilion,1,25:03
Ugwpod9aH2nbeECfzNR4AaABAg,1643673600,しろわっさん,0,見た
UgwqHUTRiYeWFDYLV154AaABAg,1643673600,うるはヴァジラ,0,"開幕からわちゃわちゃ楽しかった:_猫耳るしあちゅう:
アルゲントラップしっかり覚えてるの記憶力つよつよすぎる！
裏でかなり進んでて、今まで培ってきたこと活きてるね！
無事に高レベルアルゲンテイムおめでと:_きゅん:
そしてワイバーン…るしあのその挑戦意識高いのと気合入ってる感じめちゃめちゃかっこよくて好きなのよね、そこもまた魅力の一つでもある:_ハート:
次回挑んでワイバーンゲットしよ！るしあーくは止まらねぇ！"
Ugy8hGt4AORL9H8XUSN4AaABAg,1643673600,味噌こんにゃく,1,おつるし！なんか、最近オワコン気味に見えるけど頑張ってね！
UgwvU3bGRk-SKKbzVZZ4AaABAg,1643673600,暗黒魔界のぉぉおおお ぉおぉぉおおおドラキュラデーモンサタンでびるショー君草www!!タマネギかw何,0,おつるし〜❣️❣️
Ugz9OcDQ-vqBGcpu1MV4AaABAg,1643673600,holoカプ,0,"おつるし～
今回も内容盛りだくさんの大冒険でしたね！！
次回のARK配信も楽しみにしてます:_きゅん:
るしあさん！！大大大好き～:_ハート::_ハート::_ハート:"
UgyBzQoJKobdJe-5J154AaABAg,1643673600,Ranled,0,"yup, great stream. thank you"
Ugz93Bj-E2WvZUBN64Z4AaABAg,1643673600,ニダる,0,るしあ心配💦
UgxaC1KI0AYFcKaHDPF4AaABAg,1643673600,べル,0,かわよき
Ugxr-scXHCdDqOSVIFp4AaABAg,1643673600,りしれごんさ小,0,Oh no…
UgyiMDj8FnV3cM6olYZ4AaABAg,1643673600,蒼い鳥,0,"おつるし
155万人おめでとう！
ワイバーン残念だったね...次は上手くいくよ！:_るんるん:
寝起きでふにゃふにゃになってるるーちゃん可愛いよ:_猫耳るしあちゅう:
最近嫌なことが起きているから、良いことが起きるように
只々願っております。
次回も楽しみに待ってるね♪"
Ugxq0U1evty6Kb4JDxp4AaABAg,1643673600,おにぎりゃーのライスのお兄さま,1,おつるし！るしあの可愛い所が見れてよかった。
UgzvbYyeDS3kasnoMe94AaABAg,1643673600,Red?,0,25:06 ... 😂
Ugw59D67c8y00w3ssSp4AaABAg,1643673600,Rose fox,1,I believe rushia is the first hololive member to see a mag
UgwSLlSf_oWwUCYuI894AaABAg,1643673600,月白舞,1,"るしあちゃんが落ちたのはスタミナ切れのあと、時間経過で乗ってる者を勝手に落とされるだからです

Fはただ相手のインベントリーを開けるとても便利のキーなので、Fを嫌いにならないで欲しい。"
Ugz4Fp_JRaxXIuNNJUd4AaABAg,1643673600,なのフラ,1,"ARKおつるしおつるし
アルゲンテイム改めておめでと！ワイバーンについてはリベンジ頑張ってねー"
UgxhoedhiiiOpR5Vd7V4AaABAg,1643673600,ちー,1,"アーカイブ見てきた!!ちょいちょいリアタイできたの嬉しかった～! ありがとう!
最初のハプニングは完全に事故＆ついてなかったけれど、そんな状況でもミッション達成するのさするし!
ワイバーンすごい惜しかったね! うまくいったなと思った瞬間にビームでいちころだもの、見つかってなかったと思うんだけどな～。なかなかたまドロ難しいんだな〜、でもリトライすればもうとれそうだったね!
るしあーく!見ている側でもはらはらどきどきがあって楽しい!"
Ugycm8YUVrkuNp8M30R4AaABAg,1643673600,クロガネマル,1,"配信おつるしー！
久々に会えて嬉しかったですぁ！(アーカイブ観てた民)
全ロス痛かったですが、ワイバーン見せてくれてありがとです！超カッコイイですねワイバーンって！
いつかアレを従えるるしあさんを見てみたい！その日まで頑張るしあ！
配信お疲れ様でした〜！"
Ugyo_7OX0Ibox-1jSm14AaABAg,1643673600,ダニエル,1,おつるしー配信全部見れなかったけど元気なるしあかのことを久しぶりに見れて嬉しかった楽しい配信ありがとうこれからもよろしく
Ugw2oY3_b6YP97sTY2R4AaABAg,1643673600,てんか,1,"おつるし〜:_きゅん:
裏で頑張りすぎよw"
UgyUqD3VYMRi5ad4p0h4AaABAg,1643673600,優希,1,"寝起きのるしあが見れて幸せです…✨
どうかお元気で…✨"
UgxAIQV398RbjBRsVTp4AaABAg,1643673600,Félix A.G,1,Arigatou Rushia!
UgxaX_tcGBZ1WO81cw94AaABAg,1643673600,bui bach,1,"uh I think this is kinda late but apologise to you about our fellow immature Vietnamese. People that are Vietnamese that spam in your chat thought that it's a new trend of using your avatar so they raided your stream to say not so nice things to you. There's no rule of age restrictions to using a phone in our country so kids, teens and other uneducated, mentally ill people can use them to access the internet. Not all Vietnamese are the same, some are uneducated, angry, violent, reckless, toxic...etc, some are polite, respectful and kind. I borrowed this idea from a user name Mèo Đenz, who is again polite respectful, kind and is conscious in every action he/she made, not like the others. I hope you don't ban us from the chat/streams of yours. You're a cute, generous, kind-hearted person who has a lovely voice. If our fellow Vietnamese are very annoying and disturbing to you and the others, feel free to ban them, I just don't want them to cause a ruckus for you and the other foreign friends, I don't want our reputations to be bad in other countries eye. Have a great day."
UgyNkDeVsxgYFaRKFRV4AaABAg,1643673600,ワラソティス,1,"配信おつるし！
アルゲンデイヴィステイムないすぅ！トラップも上手くいってよかったね！アルファカルノ君は岩に挟まれて嬉しそうだったw
次回はワイバーンかな？お仕事とかポケモンの育成とかで時間なさそうやけど、裏作業は自分のペースでゆっくりやってもろて！いつでも待ってるよん"
UgzBmubVD8yxdovGLrh4AaABAg,1643673600,餅猫,1,"おつるしでした！
アーカイブだけど楽しそうで良かった(n´—｀n)
ARKは全然分からないけど、次どんなことやるのか楽しみ(*´艸｀*)
恐竜カッコいいヽ(*'▽'*)ﾉ
無理せず身体を大事に！次の配信も楽しみにしてますね！"
UgwIPMy2FkZXeI2CfH94AaABAg,1643673600,Longg VN,0,WTF intro 🌚🌚🌚
UgxDn-atRqeVpMjQEYB4AaABAg,1643673600,shen,1,"Rushia-Chan ""頑張ってね"" (私はタイ人です)"
UgzmZcN1-9_mCJYBE614AaABAg,1643673600,くろあ,1,"アーカイブ見たよ！
病み上がりだから無理しないでね！自分の好きなゲームを好きな時に配信してね！
ほんとにだいすきです、いつもこころのささえになってくれてありがとう！"
UgxA50AUXuA0yn9yqFR4AaABAg,1643673600,ニダる,2,"辛いことがあったらいつでも言ってね！
って急に言いたくなった。(意味は無い)"
UgxA50AUXuA0yn9yqFR4AaABAg.9XLe68-kJCk9XLempKtNcp,1643673600,くろあ,0,それなです
UgzcVEvwmajFT68cgCd4AaABAg,1643673600,イチマサモノクローム,1,Ark:_おつるしのお::_おつるしのつ::_おつるしのる::_るしあの:‼️めちゃくちゃ楽しかった:_おつるしのる::_おつるしのし::_るしあのあ:ちゃん元気になって本当に良かった:_きゅん:
Ugymcna6HxrZw8cgRM54AaABAg,1643673600,Pさん,0,22:56　草
UgyDJhWzL7FhDLZbHYJ4AaABAg,1643673600,ばばばくと,1,"るしあーく二日目お疲れ様！
アルゲンテイムで始まった冒険が、ワイバーンの卵まで！！
波乱もたっぷりでドキドキワクワクだったね！
ワイバーンリベンジ、楽しみにしてるね！"
UgwkqM_Kr7OVkyjZAKB4AaABAg,1643673600,Takiii,1,"おつるし〜:_きゅん:
風邪なのに配信してくれてありがとうね😊るーちゃんに会えて嬉しいよ！
嫌なこと全部うまくなりますように🙏マグマダイブは最終手段にとっておこう...いややっば封印してください(ゲーム内なら全然大丈夫だけどXD)"
Ugx8ZQPs0atj--QWnEh4AaABAg,1643673600,ガイファード gf,1,"配信お疲れさま:_きゅん:
三日振りに見れて良かった👍
病み上がりなので無理しないでね"
UgxAv3lhZRdhviOaUS94AaABAg,1643673600,フク郎,1,"おつるし〜(´▽｀)
次はワイバーン編だ〜！
楽しみにしてるね！"
UgwvIgzEg8UUdimF6Cl4AaABAg,1643673600,わたなべチャンネル,3,"最近のホロライブ、ARKばっかで面白くない
るしあ他のゲームやろうよ"
UgzwRE49tBgxWTB3BIR4AaABAg,1643673600,takaくん,1,体調悪くなったり、不思議現象起こったり、色々あると思うけどそんな時もあるよね。肩の力抜いて、たくさん笑って過ごしてほしい！
UgwwXWMF-Lhy47dHAHd4AaABAg,1643673600,ヘム(urh),1,"今日も配信お疲れ様:_きゅん:

鬱状態だったみたいだけどさ、それでも楽しむ時間を共有してくれてありがとう (*´꒳`*)
上手な言葉をかけれないけど…間違いなく一緒の時間を過ごせたし、それがとても幸せなんだ。

理不尽な出来事は心にくるよね…。
でも、俺はいつだって味方でいるからさ！

るしあちゃんのARKは、予想外と言うかびっくりポイントが多くて楽しい:_るんるん:
それでいて、予測可能回避不能もたくさんあるのが好き (*´∇｀*)
ハラハラするところもあるけど、大体笑いながらツッコミしてる気がするw"
Ugx3bX_0BfeXO62P8T94AaABAg,1643673600,12 12,1,おつるし
UgzDAA9ig8Baeat7En94AaABAg,1643673600,ぐります,1,風邪ひいてんのに開幕から絶好調なの草
UgxRv9SYCnmlxAdW5Pt4AaABAg,1643673600,時雨 繭,1,配信:_おつるしのお::_おつるしのつ::_おつるしのる::_おつるしのし:だよぉーー。バイトでリアタイできなくてごめんねー。アーカイブで会いに来たよー。:_猫耳るしあちゅう::_猫耳るしあちゅう::_猫耳るしあちゅう:
Ugwu9EQQWF3lMtqZhoV4AaABAg,1643673600,永遠のふぁんでっど,1,"配信おつるしです！！声が元気で嬉しいです！
リアタイで見れなくてすみません！！"
Ugyk_d5_zWPL4xjdCzN4AaABAg,1643673600,KIRUA,2,"おつるし〜！
るしあーく楽しかったし会えて嬉しかったよ！
今日もありがとう"
Ugx0O_vEXOKXTCiHTYR4AaABAg,1643673600,水樹,0,おつるし( ・∀・)っ🍵
UgzN6XOqGkALN7cgWIx4AaABAg,1643673600,🐈よーくん🐈【みけさんの家畜】,1,"るーちゃんおつるしでした！！ほんとワイバーンの卵は惜しかったね💦
次だ次だぁぁぁ！！
楽しい配信ありがとね😌"
Ugwju8lwmWkHKa_lGhR4AaABAg,1643673600,Paru,2,"おつるし〜！
今回も波乱の冒険やったね！まさにこれがARKって感じのハラハラドキドキだった！ワイバーン…今回は惜しかったから次回リベンジ果たしたいね！
今日もありがとう！:_きゅん:"
Ugyaf-aY_r8pEjqMn6V4AaABAg,1643673600,ひみつのあっこちゃん,1,"開幕、裏での作業が順調すぎてニコニコのるしあ
絶対フラグだからどうなるか楽しみ"
Ugw4ROGmGwnaBwGBtxZ4AaABAg,1643673600,nokoのこ,1,20:27 ガチ可愛いw
UgyQCIl6L79o7cB4vb54AaABAg,1643673600,とーま【犬もどき】,2,"配信おつるし〜！寝起きるしゃのうざかわいい好きすぎた:_きゅん:
どんな時でも素直な感情で向き合ってくれてありがとう。私たちにできることがあったらなんでも言ってね！
次の配信も楽しみにしてる！"
UgwgEqIW7BXJPG621L14AaABAg,1643673600,凜祢,1,るしあちゃん、幸せな時間をありがとうね:_猫耳るしあちゅう:
UgzjMBCO9zbkkGnRt4J4AaABAg,1643673600,くろあ,2,"おつるし！途中までしか見てないからアーカイブ見るね！
可愛い声が聞けてよかったし、元気なところ見れてよかったよ！
楽しい時間ありがとう！！"
UgzPSwPmXaTN-O9aslx4AaABAg,1643673600,まきりん,1,"おつるし〜
サムネのイラスト描いた絵師さんが
知りたい笑"
Ugyy_SxugmiP9CP3SpJ4AaABAg,1643673600,ヴェルとか璃狐[りこ]。,1,おつるし〜！出会いと別れ…これがるしあーく！楽しい配信、その為の準備もありがとう〜！ワイバーン編もすごく楽しみにしてますね！:_ハート::_きゅん:
Ugz19iDCUf8TDDkQbJh4AaABAg,1643673600,おたふく。,1,"るしあーく2日目おつるし！
るしあちゃんの冒険はドキドキハラハラがいっぱいで見てて楽しいんだ〜:_きゅん:ワイバーンチャレンジは失敗だったけどちゃんと準備したらいけるってアルゲンでも証明されてるからしっかり準備して今度こそ卵盗んでやろーぜ！ 

なにかできるわけではないけどずっとそばにはいるからね。なでなで"
UgyGhLnFNfUyYE0gq_N4AaABAg,1643673600,ニノニノちゃん,2,"おつるし！
るしあーく楽しかったよ！
また楽しみにしてるね！"
UgynEY0trNTWRNTun7x4AaABAg,1643673600,ミコト,1,"おつるし！
いつも世界一可愛いるしあが大好きだよ！
ARKは俺は全然分からないのに、るしあが楽しそうにプレイしてるのを見てるだけですごく楽しかったよ！

無理はしないでね、休みたい時は休んでね、元気なるしあが1番だよ
おつるしー！またね！"
UgxF0RRRARiuZDjLnq14AaABAg,1643673600,シンカー,1,Arkおつるしでした〜！
UgxF7AMSDBji_TovUUJ4AaABAg,1643673600,うすみどり,1,"るしあーくおつるし！
何事もド根性で突き進む、成せばなる的なるしあちゃんの冒険スタイル見ててすごーく楽しかったよ！
所々ヒヤヒヤもしたけど冒険にスリルはつきものね…！
今日もるしあちゃんとわいわい遊べて嬉しかったよ:_るんるん::_きゅん:
素敵な時間をありがとう:_ハート:"
Ugx0obgZ9HzgHK4qC9x4AaABAg,1643673600,YT C,2,配信おつるし！るしあちゃんと過ごす時間は一番幸せ時間でした！今日も本当にありがとうね！
UgyLPnnedwWhRmY-vM14AaABAg,1643673600,師走ナツメ,1,おつるし！久しぶりに配信見れてうれしかった！ゆっくり休んで体調整えてね、
UgyPF1D-DXvb-FgSSb94AaABAg,1643673600,ジェシャン,2,"配信おつるし〜！会いに来てくれてありがとうね
配信の準備とかお仕事とか、いつもお疲れ様だよ！
ご飯食べたらゆっくり休んでね:_きゅん::_ハート:大大大好き！
お大事にね！"
Ugzy3UZg9NAi47OWfat4AaABAg,1643673600,りゅうき,1,おつるしなのです！元気になってくれてよかった！！でも本当に体調には気をつけてゆっくりでいいから頑張ってね！！誕生日まであと少し！:_待機中:
Ugy97-KQu8ysNlN0bnh4AaABAg,1643673600,しゅ〜か,3,"るしあーく無限に見られるなぁ〜それくらい見ていて楽しい。
こんなに楽しい配信をありがと！"
UgwYAjH6rKOGm8fuRGd4AaABAg,1643673600,ゆっくりRubyルビー,6,配信おつるし！！久々に元気なところ見れてよかった！！
Ugx2fR9QA-qme7gVyMh4AaABAg,1643673600,バタモン╰ お兄ちゃん,1,"おつるしだよ〜
ワイバーンの卵惜しかったね、しっかり準備すれば次はいけそうだね〜
Arkやったことないけどるーちゃんの見てるだけでも楽しい！☺️"
UgzwuyiLubSacceGH3Z4AaABAg,1643673600,門,1,数日ぶりに配信が見れて嬉しい:_きゅん:
Ugxlt0qAmXh9UbYGDQV4AaABAg,1643673600,ワンナ,1,"るしあちゃん長い時間おつるし！
今日も楽しかったね！最後の卵は惜しかった！

るしあちゃんもいろいろ大変だったね、話せないけど。
でもふぁんでっとはいつもるしあちゃんの味方だよ！:_きゅん:
るしあちゃんの力になりたい！
元気になったらいいな:_おこなのです:ゆっくり休んでください～"
UgxfyjXf-XwIQCgxlZR4AaABAg,1643673600,マサラ人サトシ,2,"おつるし！:_るんるん:
久しぶりの生放送楽しかったよ！
次回はワイバーンの卵をゲットできるといいね！

ゆっくり休んでね！:_きゅん:"
Ugxb5B9W5A8ptqUW1514AaABAg,1643673600,しすこん,1,"るしアークのドキドキハラハラがクセになりそうだ…
次回も期待してんで！"
UgxERPAAgEJZ0WsBeeR4AaABAg,1643673600,誓帝愉悦,1,"るしARKおつるしだ！開幕飛び降りから始まる壮絶な物語。奴はいいプテラだったよ。
中々、無謀なことをしたり撤退判断に索敵とるしあの優秀さが局所で輝いていたな。ワイバーンはゲームによりけりでARKでも強いのだな。某ファイナル〇ードでも超強敵でおれが台パンしたくらいだｗ
深くは聞かぬが戦いが終わってお話できる時に聞かせてもらえると嬉しい。おれの勝手な我侭だ。"
UgyJLCQebGFWhi7J8gx4AaABAg,1643673600,てと。,1,"20:20
初めてコメント読んでもらって嬉しかったです！ありがとうございます！
僕だってアルゲンソロでとれますからねっ！笑
体調に気をつけて頑張ってください！！
無理はなさらないでください！"
Ugy0vFsxczYo9c1s85l4AaABAg,1643673600,Kira Asuka,27,"ARKおつるし！ワイバーンリベンジ楽しみ！
25:03 ワザップF"
UgzDc91U4eBjfT7S9Gt4AaABAg,1643673600,わん太郎,2,るしあーくおつるし！新たな仲間もゲット出来て楽しかったー！
Ugx4FaqOo0TXLtB4QkF4AaABAg,1643673600,くしきかくよー,1,おつるし！久しぶりにあえて嬉しかった！ありがとう！
UgxRnXMcpmcn7csooBl4AaABAg,1643673600,キョロ,1,"おつるし！今日も楽しかったよ！
アルゲンテイムさするし！やはりるしあの監禁技術は伊達じゃない…！
プテラ2匹残念だったね…ワイバーンやっべぇわ…
今日は会いに来てくれてありがとね！
しっかり食べてゆっくり休むんやで～"
UgxJQN2mbOa1d3rTMH54AaABAg,1643673600,ボリサムSam★,11,"Thanks for the stream Rushia!!

In the 20th she’ll be looking at the messy rooms from fandead while around 11:30pm in 21 she’ll do a birthday countdown stream."
Ugy8_QuX2LkSuWgUOut4AaABAg,1643673600,mouns,2,"危険にも怯まず積極的に進むるしあ見ていて楽しいしかわいかった！
ワイバーンへの挑戦もまた期待して待ってるよ！
たくさん準備して楽しい配信をしてくれてありがとう！"
Ugz3LxEgMdx_ANuNg294AaABAg,1643673600,kazuto,3,"おつるし！
忙しいなか配信してくれてありがとう！るしあに会えて嬉しかったよ！誕生日のカウントダウン配信も楽しみにしてるよ！155万人おめでとう！"
UgwSCb2sZfMuQ6Pbtm14AaABAg,1643673600,エゴ信者,2,おつるし！元気な姿見してくれてありがとう!!
Ugwf130sWDIpmusmENl4AaABAg,1643673600,ネイ 🦋,0,今回も配信に間に合わなかった…
UgyeIRXgsy-Dgu7UE594AaABAg,1643673600,たっぴぃ_Tappy,1,おつるし！病み上がりなのに配信ありがとう:_きゅん:ゆっくり休んでね！
Ugz6V4lQe7VxDANY2zd4AaABAg,1643673600,がぶりちゅう.,1,"るしあーく２日目は大冒険だったね！
初めてワイバーン見たけれど、すごくかっこよかったし強かった…！
プテラが集まったらリベンジマッチだね！
わちゃわちゃるしあと冒険するの大好きっ！:_猫耳るしあちゅう:"
Ugy1HMbfxS_bqeMvfA14AaABAg,1643673600,DEF ABC,1,"おつるしー
アルゲン捕まえて良かったなーいい経験も手に入れたしねー
遊びたいならいつでも呼んでねー"
UgwnVq7Bud2yVctsRat4AaABAg,1643673600,忠犬ホスト(柴),3,"配信おつるし！
やっぱりARKをしてるるしあはとても楽しそうで、見てるこっちも幸せだ。


最後はやっぱり元気なかったよ。
お疲れ様。
俺はるしあの味方だからね。"
UgxmzjCq7yvK5KVDfpJ4AaABAg,1643673600,ぜりー,1,"おつるしあーく！
ワイバーン惜しかったああああ！165のライトニングとか俺がほしいぐらいだわ！
でもでもアルゲンはテイムできたし、ワイバーンの巣の場所もわかったし、めっちゃ学びは多かったね！
絶対リベンジしような！次回も楽しみにしてます！:_きゅん:
色々大変だと思うけど、理不尽に負けちゃわないようにがんばるしゃ！いつも応援してんで(๑•̀ㅁ•́๑)✧
とりあえずお茶でもどうぞ( 　'-' )╮-=ﾆ=一＝三🍵)`-' )"
UgwrqY8qxW98_rViC-J4AaABAg,1643673600,ぷいぷい☆もるふ,1,"🦋:_おつるしのお::_おつるしのつ::_おつるしのる::_おつるしのし:🦖
Arkめっちゃ楽しかった〜！✨
アルゲンおめでとう！:_きゅん:
ワイバーン残念だったけど色々地形学べたから次リベンジだね！

配信してくれてありがとう！
幸せでした:_きゅん:
ゆっくり休んでね(*´﹀`*)"
UgwhNXJGcovncnzBYsV4AaABAg,1643673600,もるげんろーと,1,"るしあーくおつるし〜
配信見ながらやっぱロングるしゃめっちゃかわいいな〜ってひたすら思ってた…w
何とかプラスにはなったね！今回の経験を活かしてリベンジや！次回も楽しみにしてるよ！"
UgxQlwPNaw2bhvN9MB94AaABAg,1643673600,ゆーすけ ふぁんでっど,1,"Arkおつるし！！
ワイバーン強すぎたね･･･。
でも！！るしあちゃんなら次で絶対にタマゴ手に入るよ☺️
今日も最高に楽しかったよ:_きゅん:
素敵な時間をありがとうね！！"
UgxtfJYz2uzrpr4TIBV4AaABAg,1643673600,どんくささにほんチャンピオン,1,"るしあちゃん155万人おめでと〜！！
ワイバーン強すぎたねぇ〜…
あいつにゃかてねぇ！るしあちゃんのつよつよプレイでいつか絶対テイムしようぜ！！
楽しかった"
Ugy9Kv6UxVmpUkmrW2F4AaABAg,1643673600,余が来たぞ！,1,いつも声が聞けて嬉しいです
UgwnmmcmTRzhFqUYSuN4AaABAg,1643673600,じゅん【ちゃま】,1,"これもまたるしあーく！何が起こるかわからない！:_るんるん:
今日もお勉強になりまちた！おつるし！:_きゅん::_ハート:"
UgzopaYk5pVhCEM1knF4AaABAg,1643673600,S.S,3,"おつるし〜:_きゅん:
ワイバーンの卵惜しかったね次挑む時はバレずに頑張ろう〜
次回の配信も楽しみにしてるね:_るんるん:いつも応援してるよ📣:_きゅん:"
UgyvPZOvk4I1H8iHPD94AaABAg,1643673600,水無月Minazuki,1,Rushia daisuki:_ハート::_ハート::_ハート:
Ugx59HB7QCIJY-l0FYh4AaABAg,1643673600,守名しづき,1,"ワイバーンつらかったね…これがARK…！
アルゲンおめでとう！リベンジも楽しみにしてる！"
UgxPrmzY_-BNEhOh5W14AaABAg,1643673600,中澤,1,"おつるし～
アルゲンテイムおめでと～
次はワイバーンやね
まぁゆっくり行こや"
UgwONeD5LOtTGjB2HKJ4AaABAg,1643673600,"fire,",0,"るしARKお疲れさま！
今回はかなり大冒険したね！強いアルゲンテイムおめでとう！
ワイバーンも次はリベンジできそう！
また遊ぼうね！配信ありがとー"
UgwpnfiM4tB6RHxZwS14AaABAg,1643673600,Doro,1,おつるし〜
UgyREuBBPsbHLz3IAIp4AaABAg,1643673600,ふわもこ。🍓。,1,マグマに突っ込むるしあがかわいかった:_るんるん:w
UgzoFD-eoDk3dkCoWm94AaABAg,1643673600,ラプ靴,3,おつるしだよ！楽しい時間をありがとう！
Ugx-pBnXKKO4dyxAGpF4AaABAg,1643673600,轟焦凍,1,配信お疲れ様です
Ugwkogxm7Fct6LNuB8V4AaABAg,1643673600,とあるゲーマーの漢リルク,2,"久々にるしあに会えて嬉しかった！
おつるし〜"
